{
  "format": "blogman-issue-23-pre-cas-bindings/v2",
  "state": "sealed-local-only",
  "produced_at": "2026-07-27T08:15:30.000Z",
  "executor_started": false,
  "production_authorization_granted": false,
  "formal_pre_migration_candidate_created": false,
  "immutable_phase_b_bindings": {
    "candidateId": "39523f114316b05f9331c3daf77707ffcb81a59f",
    "approvalPacketSha256": "9ab75338f5ff001aa4f46c4ae118b6156b3e10f404268d5945a198065e440896",
    "buildArchiveSha256": "0467e69cf0c0943b2eafc53958bab5a6b8b1c227cae6f0a24731d9436d1af6f7",
    "baselineDeploymentId": "92422ae1-e7ce-45b7-95ab-bac8cc69f808",
    "baselineVersionId": "bf8666ae-996f-496d-a090-4c779ad57c3a"
  },
  "migration_set_sha256": "af8e6d00dabeeb08b8d830b39e86c1fe339d2eab09eb7d97119674745a126144",
  "stage_counts": {
    "pre_cas_local_gates": 0,
    "cas1": 0,
    "d1_identity": 0,
    "remote_migration_plan": 0,
    "export": 0,
    "double_restore": 0,
    "upload": 0,
    "migrations_001_006": 0,
    "cas2": 0,
    "traffic": 0,
    "smoke_reconcile": 0,
    "t0": 0
  },
  "start_conditions": {
    "fresh_candidate_bound_authorization_required": true,
    "no_prior_lineage_reuse": true
  }
}
